False	2002.03651v4.pdf	Real-time Instance Segmentation; MSCOCO; Frame (fps)	CRVOS: CLUE REFINING NETWORK FOR VIDEO OBJECT SEGMENTATION The encoder-decoder based methods for semi-supervised video object segmentation (Semi-VOS) have received extensive attention due to their superior performances. However, most of them have complex intermediate networks which generate strong specifiers to be robust against challenging scenarios , and this is quite inefficient when dealing with relatively simple scenarios. To solve this problem, we propose a real-time network, Clue Refining Network for Video Object Segmentation (CRVOS), that does not have any intermediate network to efficiently deal with these scenarios. In this work, we propose a simple specifier, referred to as the Clue, which consists of the previous frames coarse mask and coordinates information. We also propose a novel refine module which shows the better performance compared with the general ones by using a deconvolution layer instead of a bilinear upsam-pling layer. Our proposed method shows the fastest speed among the existing methods with a competitive accuracy. On DAVIS 2016 validation set, our method achieves 63.5 fps and J &F score of 81.6%.  Table 3: Ablation studies on DAVIS 2016 validation set. RM indicates using our novel refine modules instead of general ones. PM indicates using previous frame's coarse mask as a specifier, and Clue indicates using the Clue as a specifier. Evaluation of the entire targets are generated , and then overlapped . 3 . ( 0 . 75?1 . 25 ) for data augmentation in fine - tuning stage . F ? fps J ?
False	2002.03651v4.pdf	Image-to-Image Translation; Cityscapes Labels-to-Photo; FID	CRVOS: CLUE REFINING NETWORK FOR VIDEO OBJECT SEGMENTATION The encoder-decoder based methods for semi-supervised video object segmentation (Semi-VOS) have received extensive attention due to their superior performances. However, most of them have complex intermediate networks which generate strong specifiers to be robust against challenging scenarios , and this is quite inefficient when dealing with relatively simple scenarios. To solve this problem, we propose a real-time network, Clue Refining Network for Video Object Segmentation (CRVOS), that does not have any intermediate network to efficiently deal with these scenarios. In this work, we propose a simple specifier, referred to as the Clue, which consists of the previous frames coarse mask and coordinates information. We also propose a novel refine module which shows the better performance compared with the general ones by using a deconvolution layer instead of a bilinear upsam-pling layer. Our proposed method shows the fastest speed among the existing methods with a competitive accuracy. On DAVIS 2016 validation set, our method achieves 63.5 fps and J &F score of 81.6%.  Table 3: Ablation studies on DAVIS 2016 validation set. RM indicates using our novel refine modules instead of general ones. PM indicates using previous frame's coarse mask as a specifier, and Clue indicates using the Clue as a specifier. Evaluation of the entire targets are generated , and then overlapped . 3 . ( 0 . 75?1 . 25 ) for data augmentation in fine - tuning stage . F ? fps J ?
False	2002.03651v4.pdf	Neural Architecture Search; ImageNet; Accuracy	CRVOS: CLUE REFINING NETWORK FOR VIDEO OBJECT SEGMENTATION The encoder-decoder based methods for semi-supervised video object segmentation (Semi-VOS) have received extensive attention due to their superior performances. However, most of them have complex intermediate networks which generate strong specifiers to be robust against challenging scenarios , and this is quite inefficient when dealing with relatively simple scenarios. To solve this problem, we propose a real-time network, Clue Refining Network for Video Object Segmentation (CRVOS), that does not have any intermediate network to efficiently deal with these scenarios. In this work, we propose a simple specifier, referred to as the Clue, which consists of the previous frames coarse mask and coordinates information. We also propose a novel refine module which shows the better performance compared with the general ones by using a deconvolution layer instead of a bilinear upsam-pling layer. Our proposed method shows the fastest speed among the existing methods with a competitive accuracy. On DAVIS 2016 validation set, our method achieves 63.5 fps and J &F score of 81.6%.  Table 3: Ablation studies on DAVIS 2016 validation set. RM indicates using our novel refine modules instead of general ones. PM indicates using previous frame's coarse mask as a specifier, and Clue indicates using the Clue as a specifier. Evaluation of the entire targets are generated , and then overlapped . 3 . ( 0 . 75?1 . 25 ) for data augmentation in fine - tuning stage . F ? fps J ?
False	2002.03651v4.pdf	Few-Shot Image Classification; FC100 5-way (5-shot); Accuracy	CRVOS: CLUE REFINING NETWORK FOR VIDEO OBJECT SEGMENTATION The encoder-decoder based methods for semi-supervised video object segmentation (Semi-VOS) have received extensive attention due to their superior performances. However, most of them have complex intermediate networks which generate strong specifiers to be robust against challenging scenarios , and this is quite inefficient when dealing with relatively simple scenarios. To solve this problem, we propose a real-time network, Clue Refining Network for Video Object Segmentation (CRVOS), that does not have any intermediate network to efficiently deal with these scenarios. In this work, we propose a simple specifier, referred to as the Clue, which consists of the previous frames coarse mask and coordinates information. We also propose a novel refine module which shows the better performance compared with the general ones by using a deconvolution layer instead of a bilinear upsam-pling layer. Our proposed method shows the fastest speed among the existing methods with a competitive accuracy. On DAVIS 2016 validation set, our method achieves 63.5 fps and J &F score of 81.6%.  Table 3: Ablation studies on DAVIS 2016 validation set. RM indicates using our novel refine modules instead of general ones. PM indicates using previous frame's coarse mask as a specifier, and Clue indicates using the Clue as a specifier. Evaluation of the entire targets are generated , and then overlapped . 3 . ( 0 . 75?1 . 25 ) for data augmentation in fine - tuning stage . F ? fps J ?
False	2002.03651v4.pdf	Atari Games; Atari 2600 Pooyan; Score	CRVOS: CLUE REFINING NETWORK FOR VIDEO OBJECT SEGMENTATION The encoder-decoder based methods for semi-supervised video object segmentation (Semi-VOS) have received extensive attention due to their superior performances. However, most of them have complex intermediate networks which generate strong specifiers to be robust against challenging scenarios , and this is quite inefficient when dealing with relatively simple scenarios. To solve this problem, we propose a real-time network, Clue Refining Network for Video Object Segmentation (CRVOS), that does not have any intermediate network to efficiently deal with these scenarios. In this work, we propose a simple specifier, referred to as the Clue, which consists of the previous frames coarse mask and coordinates information. We also propose a novel refine module which shows the better performance compared with the general ones by using a deconvolution layer instead of a bilinear upsam-pling layer. Our proposed method shows the fastest speed among the existing methods with a competitive accuracy. On DAVIS 2016 validation set, our method achieves 63.5 fps and J &F score of 81.6%.  Table 3: Ablation studies on DAVIS 2016 validation set. RM indicates using our novel refine modules instead of general ones. PM indicates using previous frame's coarse mask as a specifier, and Clue indicates using the Clue as a specifier. Evaluation of the entire targets are generated , and then overlapped . 3 . ( 0 . 75?1 . 25 ) for data augmentation in fine - tuning stage . F ? fps J ?
False	2002.03651v4.pdf	Cross-Lingual NER; CoNLL Dutch; F1	CRVOS: CLUE REFINING NETWORK FOR VIDEO OBJECT SEGMENTATION The encoder-decoder based methods for semi-supervised video object segmentation (Semi-VOS) have received extensive attention due to their superior performances. However, most of them have complex intermediate networks which generate strong specifiers to be robust against challenging scenarios , and this is quite inefficient when dealing with relatively simple scenarios. To solve this problem, we propose a real-time network, Clue Refining Network for Video Object Segmentation (CRVOS), that does not have any intermediate network to efficiently deal with these scenarios. In this work, we propose a simple specifier, referred to as the Clue, which consists of the previous frames coarse mask and coordinates information. We also propose a novel refine module which shows the better performance compared with the general ones by using a deconvolution layer instead of a bilinear upsam-pling layer. Our proposed method shows the fastest speed among the existing methods with a competitive accuracy. On DAVIS 2016 validation set, our method achieves 63.5 fps and J &F score of 81.6%.  Table 3: Ablation studies on DAVIS 2016 validation set. RM indicates using our novel refine modules instead of general ones. PM indicates using previous frame's coarse mask as a specifier, and Clue indicates using the Clue as a specifier. Evaluation of the entire targets are generated , and then overlapped . 3 . ( 0 . 75?1 . 25 ) for data augmentation in fine - tuning stage . F ? fps J ?
False	2002.03651v4.pdf	Activity Prediction; ActEV; mAP	CRVOS: CLUE REFINING NETWORK FOR VIDEO OBJECT SEGMENTATION The encoder-decoder based methods for semi-supervised video object segmentation (Semi-VOS) have received extensive attention due to their superior performances. However, most of them have complex intermediate networks which generate strong specifiers to be robust against challenging scenarios , and this is quite inefficient when dealing with relatively simple scenarios. To solve this problem, we propose a real-time network, Clue Refining Network for Video Object Segmentation (CRVOS), that does not have any intermediate network to efficiently deal with these scenarios. In this work, we propose a simple specifier, referred to as the Clue, which consists of the previous frames coarse mask and coordinates information. We also propose a novel refine module which shows the better performance compared with the general ones by using a deconvolution layer instead of a bilinear upsam-pling layer. Our proposed method shows the fastest speed among the existing methods with a competitive accuracy. On DAVIS 2016 validation set, our method achieves 63.5 fps and J &F score of 81.6%.  Table 3: Ablation studies on DAVIS 2016 validation set. RM indicates using our novel refine modules instead of general ones. PM indicates using previous frame's coarse mask as a specifier, and Clue indicates using the Clue as a specifier. Evaluation of the entire targets are generated , and then overlapped . 3 . ( 0 . 75?1 . 25 ) for data augmentation in fine - tuning stage . F ? fps J ?
False	2002.03651v4.pdf	Video Super-Resolution; Ultra Video Group HD - 4x upscaling; Average PSNR	CRVOS: CLUE REFINING NETWORK FOR VIDEO OBJECT SEGMENTATION The encoder-decoder based methods for semi-supervised video object segmentation (Semi-VOS) have received extensive attention due to their superior performances. However, most of them have complex intermediate networks which generate strong specifiers to be robust against challenging scenarios , and this is quite inefficient when dealing with relatively simple scenarios. To solve this problem, we propose a real-time network, Clue Refining Network for Video Object Segmentation (CRVOS), that does not have any intermediate network to efficiently deal with these scenarios. In this work, we propose a simple specifier, referred to as the Clue, which consists of the previous frames coarse mask and coordinates information. We also propose a novel refine module which shows the better performance compared with the general ones by using a deconvolution layer instead of a bilinear upsam-pling layer. Our proposed method shows the fastest speed among the existing methods with a competitive accuracy. On DAVIS 2016 validation set, our method achieves 63.5 fps and J &F score of 81.6%.  Table 3: Ablation studies on DAVIS 2016 validation set. RM indicates using our novel refine modules instead of general ones. PM indicates using previous frame's coarse mask as a specifier, and Clue indicates using the Clue as a specifier. Evaluation of the entire targets are generated , and then overlapped . 3 . ( 0 . 75?1 . 25 ) for data augmentation in fine - tuning stage . F ? fps J ?
False	2002.03651v4.pdf	Human Pose Forecasting; Human3.6M; MAR, walking, 400ms	CRVOS: CLUE REFINING NETWORK FOR VIDEO OBJECT SEGMENTATION The encoder-decoder based methods for semi-supervised video object segmentation (Semi-VOS) have received extensive attention due to their superior performances. However, most of them have complex intermediate networks which generate strong specifiers to be robust against challenging scenarios , and this is quite inefficient when dealing with relatively simple scenarios. To solve this problem, we propose a real-time network, Clue Refining Network for Video Object Segmentation (CRVOS), that does not have any intermediate network to efficiently deal with these scenarios. In this work, we propose a simple specifier, referred to as the Clue, which consists of the previous frames coarse mask and coordinates information. We also propose a novel refine module which shows the better performance compared with the general ones by using a deconvolution layer instead of a bilinear upsam-pling layer. Our proposed method shows the fastest speed among the existing methods with a competitive accuracy. On DAVIS 2016 validation set, our method achieves 63.5 fps and J &F score of 81.6%.  Table 3: Ablation studies on DAVIS 2016 validation set. RM indicates using our novel refine modules instead of general ones. PM indicates using previous frame's coarse mask as a specifier, and Clue indicates using the Clue as a specifier. Evaluation of the entire targets are generated , and then overlapped . 3 . ( 0 . 75?1 . 25 ) for data augmentation in fine - tuning stage . F ? fps J ?
False	2002.03651v4.pdf	Face Detection; WIDER Face (Medium); AP	CRVOS: CLUE REFINING NETWORK FOR VIDEO OBJECT SEGMENTATION The encoder-decoder based methods for semi-supervised video object segmentation (Semi-VOS) have received extensive attention due to their superior performances. However, most of them have complex intermediate networks which generate strong specifiers to be robust against challenging scenarios , and this is quite inefficient when dealing with relatively simple scenarios. To solve this problem, we propose a real-time network, Clue Refining Network for Video Object Segmentation (CRVOS), that does not have any intermediate network to efficiently deal with these scenarios. In this work, we propose a simple specifier, referred to as the Clue, which consists of the previous frames coarse mask and coordinates information. We also propose a novel refine module which shows the better performance compared with the general ones by using a deconvolution layer instead of a bilinear upsam-pling layer. Our proposed method shows the fastest speed among the existing methods with a competitive accuracy. On DAVIS 2016 validation set, our method achieves 63.5 fps and J &F score of 81.6%.  Table 3: Ablation studies on DAVIS 2016 validation set. RM indicates using our novel refine modules instead of general ones. PM indicates using previous frame's coarse mask as a specifier, and Clue indicates using the Clue as a specifier. Evaluation of the entire targets are generated , and then overlapped . 3 . ( 0 . 75?1 . 25 ) for data augmentation in fine - tuning stage . F ? fps J ?
False	2002.03651v4.pdf	Scene Text Detection; Total-Text; Precision	CRVOS: CLUE REFINING NETWORK FOR VIDEO OBJECT SEGMENTATION The encoder-decoder based methods for semi-supervised video object segmentation (Semi-VOS) have received extensive attention due to their superior performances. However, most of them have complex intermediate networks which generate strong specifiers to be robust against challenging scenarios , and this is quite inefficient when dealing with relatively simple scenarios. To solve this problem, we propose a real-time network, Clue Refining Network for Video Object Segmentation (CRVOS), that does not have any intermediate network to efficiently deal with these scenarios. In this work, we propose a simple specifier, referred to as the Clue, which consists of the previous frames coarse mask and coordinates information. We also propose a novel refine module which shows the better performance compared with the general ones by using a deconvolution layer instead of a bilinear upsam-pling layer. Our proposed method shows the fastest speed among the existing methods with a competitive accuracy. On DAVIS 2016 validation set, our method achieves 63.5 fps and J &F score of 81.6%.  Table 3: Ablation studies on DAVIS 2016 validation set. RM indicates using our novel refine modules instead of general ones. PM indicates using previous frame's coarse mask as a specifier, and Clue indicates using the Clue as a specifier. Evaluation of the entire targets are generated , and then overlapped . 3 . ( 0 . 75?1 . 25 ) for data augmentation in fine - tuning stage . F ? fps J ?
False	2002.03651v4.pdf	Link Prediction; YAGO3-10; Hits@1	CRVOS: CLUE REFINING NETWORK FOR VIDEO OBJECT SEGMENTATION The encoder-decoder based methods for semi-supervised video object segmentation (Semi-VOS) have received extensive attention due to their superior performances. However, most of them have complex intermediate networks which generate strong specifiers to be robust against challenging scenarios , and this is quite inefficient when dealing with relatively simple scenarios. To solve this problem, we propose a real-time network, Clue Refining Network for Video Object Segmentation (CRVOS), that does not have any intermediate network to efficiently deal with these scenarios. In this work, we propose a simple specifier, referred to as the Clue, which consists of the previous frames coarse mask and coordinates information. We also propose a novel refine module which shows the better performance compared with the general ones by using a deconvolution layer instead of a bilinear upsam-pling layer. Our proposed method shows the fastest speed among the existing methods with a competitive accuracy. On DAVIS 2016 validation set, our method achieves 63.5 fps and J &F score of 81.6%.  Table 3: Ablation studies on DAVIS 2016 validation set. RM indicates using our novel refine modules instead of general ones. PM indicates using previous frame's coarse mask as a specifier, and Clue indicates using the Clue as a specifier. Evaluation of the entire targets are generated , and then overlapped . 3 . ( 0 . 75?1 . 25 ) for data augmentation in fine - tuning stage . F ? fps J ?
False	2002.03651v4.pdf	Heterogeneous Node Classification; DBLP (PACT) 14k; Macro-F1 (60% training data)	CRVOS: CLUE REFINING NETWORK FOR VIDEO OBJECT SEGMENTATION The encoder-decoder based methods for semi-supervised video object segmentation (Semi-VOS) have received extensive attention due to their superior performances. However, most of them have complex intermediate networks which generate strong specifiers to be robust against challenging scenarios , and this is quite inefficient when dealing with relatively simple scenarios. To solve this problem, we propose a real-time network, Clue Refining Network for Video Object Segmentation (CRVOS), that does not have any intermediate network to efficiently deal with these scenarios. In this work, we propose a simple specifier, referred to as the Clue, which consists of the previous frames coarse mask and coordinates information. We also propose a novel refine module which shows the better performance compared with the general ones by using a deconvolution layer instead of a bilinear upsam-pling layer. Our proposed method shows the fastest speed among the existing methods with a competitive accuracy. On DAVIS 2016 validation set, our method achieves 63.5 fps and J &F score of 81.6%.  Table 3: Ablation studies on DAVIS 2016 validation set. RM indicates using our novel refine modules instead of general ones. PM indicates using previous frame's coarse mask as a specifier, and Clue indicates using the Clue as a specifier. Evaluation of the entire targets are generated , and then overlapped . 3 . ( 0 . 75?1 . 25 ) for data augmentation in fine - tuning stage . F ? fps J ?
False	2002.03651v4.pdf	Word Sense Disambiguation; SemEval 2007 Task 17; F1	CRVOS: CLUE REFINING NETWORK FOR VIDEO OBJECT SEGMENTATION The encoder-decoder based methods for semi-supervised video object segmentation (Semi-VOS) have received extensive attention due to their superior performances. However, most of them have complex intermediate networks which generate strong specifiers to be robust against challenging scenarios , and this is quite inefficient when dealing with relatively simple scenarios. To solve this problem, we propose a real-time network, Clue Refining Network for Video Object Segmentation (CRVOS), that does not have any intermediate network to efficiently deal with these scenarios. In this work, we propose a simple specifier, referred to as the Clue, which consists of the previous frames coarse mask and coordinates information. We also propose a novel refine module which shows the better performance compared with the general ones by using a deconvolution layer instead of a bilinear upsam-pling layer. Our proposed method shows the fastest speed among the existing methods with a competitive accuracy. On DAVIS 2016 validation set, our method achieves 63.5 fps and J &F score of 81.6%.  Table 3: Ablation studies on DAVIS 2016 validation set. RM indicates using our novel refine modules instead of general ones. PM indicates using previous frame's coarse mask as a specifier, and Clue indicates using the Clue as a specifier. Evaluation of the entire targets are generated , and then overlapped . 3 . ( 0 . 75?1 . 25 ) for data augmentation in fine - tuning stage . F ? fps J ?
False	2002.03651v4.pdf	Neural Architecture Search; CIFAR-10; Search Time (GPU days)	CRVOS: CLUE REFINING NETWORK FOR VIDEO OBJECT SEGMENTATION The encoder-decoder based methods for semi-supervised video object segmentation (Semi-VOS) have received extensive attention due to their superior performances. However, most of them have complex intermediate networks which generate strong specifiers to be robust against challenging scenarios , and this is quite inefficient when dealing with relatively simple scenarios. To solve this problem, we propose a real-time network, Clue Refining Network for Video Object Segmentation (CRVOS), that does not have any intermediate network to efficiently deal with these scenarios. In this work, we propose a simple specifier, referred to as the Clue, which consists of the previous frames coarse mask and coordinates information. We also propose a novel refine module which shows the better performance compared with the general ones by using a deconvolution layer instead of a bilinear upsam-pling layer. Our proposed method shows the fastest speed among the existing methods with a competitive accuracy. On DAVIS 2016 validation set, our method achieves 63.5 fps and J &F score of 81.6%.  Table 3: Ablation studies on DAVIS 2016 validation set. RM indicates using our novel refine modules instead of general ones. PM indicates using previous frame's coarse mask as a specifier, and Clue indicates using the Clue as a specifier. Evaluation of the entire targets are generated , and then overlapped . 3 . ( 0 . 75?1 . 25 ) for data augmentation in fine - tuning stage . F ? fps J ?
False	2002.03651v4.pdf	3D Object Detection; KITTI Pedestrians Hard; AP	CRVOS: CLUE REFINING NETWORK FOR VIDEO OBJECT SEGMENTATION The encoder-decoder based methods for semi-supervised video object segmentation (Semi-VOS) have received extensive attention due to their superior performances. However, most of them have complex intermediate networks which generate strong specifiers to be robust against challenging scenarios , and this is quite inefficient when dealing with relatively simple scenarios. To solve this problem, we propose a real-time network, Clue Refining Network for Video Object Segmentation (CRVOS), that does not have any intermediate network to efficiently deal with these scenarios. In this work, we propose a simple specifier, referred to as the Clue, which consists of the previous frames coarse mask and coordinates information. We also propose a novel refine module which shows the better performance compared with the general ones by using a deconvolution layer instead of a bilinear upsam-pling layer. Our proposed method shows the fastest speed among the existing methods with a competitive accuracy. On DAVIS 2016 validation set, our method achieves 63.5 fps and J &F score of 81.6%.  Table 3: Ablation studies on DAVIS 2016 validation set. RM indicates using our novel refine modules instead of general ones. PM indicates using previous frame's coarse mask as a specifier, and Clue indicates using the Clue as a specifier. Evaluation of the entire targets are generated , and then overlapped . 3 . ( 0 . 75?1 . 25 ) for data augmentation in fine - tuning stage . F ? fps J ?
