False	1910.10750v1.pdf	Skeleton Based Action Recognition; JHMDB Pose Tracking; PCK@0.2	6-PACK: Category-level 6D Pose Tracker with Anchor-Based Keypoints Change of 6D Pose between frames We present 6-PACK, a deep learning approach to category-level 6D object pose tracking on RGB-D data. Our method tracks in real time novel object instances of known object categories such as bowls, laptops, and mugs. 6-PACK learns to compactly represent an object by a handful of 3D keypoints, based on which the interframe motion of an object instance can be estimated through keypoint matching. These keypoints are learned end-to-end without manual supervision in order to be most effective for tracking. Our experiments show that our method substantially outperforms existing methods on the NOCS category-level 6D pose estimation benchmark and supports a physical robot to perform simple vision-based closed-loop manipulation tasks. Our code and video are available at https://sites.google.com/view/6packtracking.
False	1910.10750v1.pdf	Skeleton Based Action Recognition; JHMDB Pose Tracking; PCK@0.5	6-PACK: Category-level 6D Pose Tracker with Anchor-Based Keypoints Change of 6D Pose between frames We present 6-PACK, a deep learning approach to category-level 6D object pose tracking on RGB-D data. Our method tracks in real time novel object instances of known object categories such as bowls, laptops, and mugs. 6-PACK learns to compactly represent an object by a handful of 3D keypoints, based on which the interframe motion of an object instance can be estimated through keypoint matching. These keypoints are learned end-to-end without manual supervision in order to be most effective for tracking. Our experiments show that our method substantially outperforms existing methods on the NOCS category-level 6D pose estimation benchmark and supports a physical robot to perform simple vision-based closed-loop manipulation tasks. Our code and video are available at https://sites.google.com/view/6packtracking.
False	1910.10750v1.pdf	Skeleton Based Action Recognition; JHMDB Pose Tracking; PCK@0.4	6-PACK: Category-level 6D Pose Tracker with Anchor-Based Keypoints Change of 6D Pose between frames We present 6-PACK, a deep learning approach to category-level 6D object pose tracking on RGB-D data. Our method tracks in real time novel object instances of known object categories such as bowls, laptops, and mugs. 6-PACK learns to compactly represent an object by a handful of 3D keypoints, based on which the interframe motion of an object instance can be estimated through keypoint matching. These keypoints are learned end-to-end without manual supervision in order to be most effective for tracking. Our experiments show that our method substantially outperforms existing methods on the NOCS category-level 6D pose estimation benchmark and supports a physical robot to perform simple vision-based closed-loop manipulation tasks. Our code and video are available at https://sites.google.com/view/6packtracking.
False	1910.10750v1.pdf	Keypoint Detection; COCO test-challenge; ARL	6-PACK: Category-level 6D Pose Tracker with Anchor-Based Keypoints Change of 6D Pose between frames We present 6-PACK, a deep learning approach to category-level 6D object pose tracking on RGB-D data. Our method tracks in real time novel object instances of known object categories such as bowls, laptops, and mugs. 6-PACK learns to compactly represent an object by a handful of 3D keypoints, based on which the interframe motion of an object instance can be estimated through keypoint matching. These keypoints are learned end-to-end without manual supervision in order to be most effective for tracking. Our experiments show that our method substantially outperforms existing methods on the NOCS category-level 6D pose estimation benchmark and supports a physical robot to perform simple vision-based closed-loop manipulation tasks. Our code and video are available at https://sites.google.com/view/6packtracking.
False	1910.10750v1.pdf	Keypoint Detection; COCO test-challenge; ARM	6-PACK: Category-level 6D Pose Tracker with Anchor-Based Keypoints Change of 6D Pose between frames We present 6-PACK, a deep learning approach to category-level 6D object pose tracking on RGB-D data. Our method tracks in real time novel object instances of known object categories such as bowls, laptops, and mugs. 6-PACK learns to compactly represent an object by a handful of 3D keypoints, based on which the interframe motion of an object instance can be estimated through keypoint matching. These keypoints are learned end-to-end without manual supervision in order to be most effective for tracking. Our experiments show that our method substantially outperforms existing methods on the NOCS category-level 6D pose estimation benchmark and supports a physical robot to perform simple vision-based closed-loop manipulation tasks. Our code and video are available at https://sites.google.com/view/6packtracking.
False	1910.10750v1.pdf	Cross-Lingual Document Classification; MLDoc Zero-Shot English-to-Chinese; Accuracy	6-PACK: Category-level 6D Pose Tracker with Anchor-Based Keypoints Change of 6D Pose between frames We present 6-PACK, a deep learning approach to category-level 6D object pose tracking on RGB-D data. Our method tracks in real time novel object instances of known object categories such as bowls, laptops, and mugs. 6-PACK learns to compactly represent an object by a handful of 3D keypoints, based on which the interframe motion of an object instance can be estimated through keypoint matching. These keypoints are learned end-to-end without manual supervision in order to be most effective for tracking. Our experiments show that our method substantially outperforms existing methods on the NOCS category-level 6D pose estimation benchmark and supports a physical robot to perform simple vision-based closed-loop manipulation tasks. Our code and video are available at https://sites.google.com/view/6packtracking.
False	1910.10750v1.pdf	Semi-Supervised Video Object Segmentation; DAVIS 2017 (test-dev); Jaccard (Decay)	6-PACK: Category-level 6D Pose Tracker with Anchor-Based Keypoints Change of 6D Pose between frames We present 6-PACK, a deep learning approach to category-level 6D object pose tracking on RGB-D data. Our method tracks in real time novel object instances of known object categories such as bowls, laptops, and mugs. 6-PACK learns to compactly represent an object by a handful of 3D keypoints, based on which the interframe motion of an object instance can be estimated through keypoint matching. These keypoints are learned end-to-end without manual supervision in order to be most effective for tracking. Our experiments show that our method substantially outperforms existing methods on the NOCS category-level 6D pose estimation benchmark and supports a physical robot to perform simple vision-based closed-loop manipulation tasks. Our code and video are available at https://sites.google.com/view/6packtracking.
False	1910.10750v1.pdf	Question Answering; WikiQA; MRR	6-PACK: Category-level 6D Pose Tracker with Anchor-Based Keypoints Change of 6D Pose between frames We present 6-PACK, a deep learning approach to category-level 6D object pose tracking on RGB-D data. Our method tracks in real time novel object instances of known object categories such as bowls, laptops, and mugs. 6-PACK learns to compactly represent an object by a handful of 3D keypoints, based on which the interframe motion of an object instance can be estimated through keypoint matching. These keypoints are learned end-to-end without manual supervision in order to be most effective for tracking. Our experiments show that our method substantially outperforms existing methods on the NOCS category-level 6D pose estimation benchmark and supports a physical robot to perform simple vision-based closed-loop manipulation tasks. Our code and video are available at https://sites.google.com/view/6packtracking.
False	1910.10750v1.pdf	Fine-Grained Image Classification; FGVC Aircraft; FLOPS	6-PACK: Category-level 6D Pose Tracker with Anchor-Based Keypoints Change of 6D Pose between frames We present 6-PACK, a deep learning approach to category-level 6D object pose tracking on RGB-D data. Our method tracks in real time novel object instances of known object categories such as bowls, laptops, and mugs. 6-PACK learns to compactly represent an object by a handful of 3D keypoints, based on which the interframe motion of an object instance can be estimated through keypoint matching. These keypoints are learned end-to-end without manual supervision in order to be most effective for tracking. Our experiments show that our method substantially outperforms existing methods on the NOCS category-level 6D pose estimation benchmark and supports a physical robot to perform simple vision-based closed-loop manipulation tasks. Our code and video are available at https://sites.google.com/view/6packtracking.
False	1910.10750v1.pdf	Real-time Instance Segmentation; MSCOCO; Frame (fps)	6-PACK: Category-level 6D Pose Tracker with Anchor-Based Keypoints Change of 6D Pose between frames We present 6-PACK, a deep learning approach to category-level 6D object pose tracking on RGB-D data. Our method tracks in real time novel object instances of known object categories such as bowls, laptops, and mugs. 6-PACK learns to compactly represent an object by a handful of 3D keypoints, based on which the interframe motion of an object instance can be estimated through keypoint matching. These keypoints are learned end-to-end without manual supervision in order to be most effective for tracking. Our experiments show that our method substantially outperforms existing methods on the NOCS category-level 6D pose estimation benchmark and supports a physical robot to perform simple vision-based closed-loop manipulation tasks. Our code and video are available at https://sites.google.com/view/6packtracking.
False	1910.10750v1.pdf	Image-to-Image Translation; Cityscapes Labels-to-Photo; FID	6-PACK: Category-level 6D Pose Tracker with Anchor-Based Keypoints Change of 6D Pose between frames We present 6-PACK, a deep learning approach to category-level 6D object pose tracking on RGB-D data. Our method tracks in real time novel object instances of known object categories such as bowls, laptops, and mugs. 6-PACK learns to compactly represent an object by a handful of 3D keypoints, based on which the interframe motion of an object instance can be estimated through keypoint matching. These keypoints are learned end-to-end without manual supervision in order to be most effective for tracking. Our experiments show that our method substantially outperforms existing methods on the NOCS category-level 6D pose estimation benchmark and supports a physical robot to perform simple vision-based closed-loop manipulation tasks. Our code and video are available at https://sites.google.com/view/6packtracking.
False	1910.10750v1.pdf	Neural Architecture Search; ImageNet; Accuracy	6-PACK: Category-level 6D Pose Tracker with Anchor-Based Keypoints Change of 6D Pose between frames We present 6-PACK, a deep learning approach to category-level 6D object pose tracking on RGB-D data. Our method tracks in real time novel object instances of known object categories such as bowls, laptops, and mugs. 6-PACK learns to compactly represent an object by a handful of 3D keypoints, based on which the interframe motion of an object instance can be estimated through keypoint matching. These keypoints are learned end-to-end without manual supervision in order to be most effective for tracking. Our experiments show that our method substantially outperforms existing methods on the NOCS category-level 6D pose estimation benchmark and supports a physical robot to perform simple vision-based closed-loop manipulation tasks. Our code and video are available at https://sites.google.com/view/6packtracking.
False	1910.10750v1.pdf	Few-Shot Image Classification; FC100 5-way (5-shot); Accuracy	6-PACK: Category-level 6D Pose Tracker with Anchor-Based Keypoints Change of 6D Pose between frames We present 6-PACK, a deep learning approach to category-level 6D object pose tracking on RGB-D data. Our method tracks in real time novel object instances of known object categories such as bowls, laptops, and mugs. 6-PACK learns to compactly represent an object by a handful of 3D keypoints, based on which the interframe motion of an object instance can be estimated through keypoint matching. These keypoints are learned end-to-end without manual supervision in order to be most effective for tracking. Our experiments show that our method substantially outperforms existing methods on the NOCS category-level 6D pose estimation benchmark and supports a physical robot to perform simple vision-based closed-loop manipulation tasks. Our code and video are available at https://sites.google.com/view/6packtracking.
False	1910.10750v1.pdf	Atari Games; Atari 2600 Pooyan; Score	6-PACK: Category-level 6D Pose Tracker with Anchor-Based Keypoints Change of 6D Pose between frames We present 6-PACK, a deep learning approach to category-level 6D object pose tracking on RGB-D data. Our method tracks in real time novel object instances of known object categories such as bowls, laptops, and mugs. 6-PACK learns to compactly represent an object by a handful of 3D keypoints, based on which the interframe motion of an object instance can be estimated through keypoint matching. These keypoints are learned end-to-end without manual supervision in order to be most effective for tracking. Our experiments show that our method substantially outperforms existing methods on the NOCS category-level 6D pose estimation benchmark and supports a physical robot to perform simple vision-based closed-loop manipulation tasks. Our code and video are available at https://sites.google.com/view/6packtracking.
False	1910.10750v1.pdf	Cross-Lingual NER; CoNLL Dutch; F1	6-PACK: Category-level 6D Pose Tracker with Anchor-Based Keypoints Change of 6D Pose between frames We present 6-PACK, a deep learning approach to category-level 6D object pose tracking on RGB-D data. Our method tracks in real time novel object instances of known object categories such as bowls, laptops, and mugs. 6-PACK learns to compactly represent an object by a handful of 3D keypoints, based on which the interframe motion of an object instance can be estimated through keypoint matching. These keypoints are learned end-to-end without manual supervision in order to be most effective for tracking. Our experiments show that our method substantially outperforms existing methods on the NOCS category-level 6D pose estimation benchmark and supports a physical robot to perform simple vision-based closed-loop manipulation tasks. Our code and video are available at https://sites.google.com/view/6packtracking.
False	1910.10750v1.pdf	Activity Prediction; ActEV; mAP	6-PACK: Category-level 6D Pose Tracker with Anchor-Based Keypoints Change of 6D Pose between frames We present 6-PACK, a deep learning approach to category-level 6D object pose tracking on RGB-D data. Our method tracks in real time novel object instances of known object categories such as bowls, laptops, and mugs. 6-PACK learns to compactly represent an object by a handful of 3D keypoints, based on which the interframe motion of an object instance can be estimated through keypoint matching. These keypoints are learned end-to-end without manual supervision in order to be most effective for tracking. Our experiments show that our method substantially outperforms existing methods on the NOCS category-level 6D pose estimation benchmark and supports a physical robot to perform simple vision-based closed-loop manipulation tasks. Our code and video are available at https://sites.google.com/view/6packtracking.
False	1910.10750v1.pdf	Video Super-Resolution; Ultra Video Group HD - 4x upscaling; Average PSNR	6-PACK: Category-level 6D Pose Tracker with Anchor-Based Keypoints Change of 6D Pose between frames We present 6-PACK, a deep learning approach to category-level 6D object pose tracking on RGB-D data. Our method tracks in real time novel object instances of known object categories such as bowls, laptops, and mugs. 6-PACK learns to compactly represent an object by a handful of 3D keypoints, based on which the interframe motion of an object instance can be estimated through keypoint matching. These keypoints are learned end-to-end without manual supervision in order to be most effective for tracking. Our experiments show that our method substantially outperforms existing methods on the NOCS category-level 6D pose estimation benchmark and supports a physical robot to perform simple vision-based closed-loop manipulation tasks. Our code and video are available at https://sites.google.com/view/6packtracking.
False	1910.10750v1.pdf	Human Pose Forecasting; Human3.6M; MAR, walking, 400ms	6-PACK: Category-level 6D Pose Tracker with Anchor-Based Keypoints Change of 6D Pose between frames We present 6-PACK, a deep learning approach to category-level 6D object pose tracking on RGB-D data. Our method tracks in real time novel object instances of known object categories such as bowls, laptops, and mugs. 6-PACK learns to compactly represent an object by a handful of 3D keypoints, based on which the interframe motion of an object instance can be estimated through keypoint matching. These keypoints are learned end-to-end without manual supervision in order to be most effective for tracking. Our experiments show that our method substantially outperforms existing methods on the NOCS category-level 6D pose estimation benchmark and supports a physical robot to perform simple vision-based closed-loop manipulation tasks. Our code and video are available at https://sites.google.com/view/6packtracking.
False	1910.10750v1.pdf	Face Detection; WIDER Face (Medium); AP	6-PACK: Category-level 6D Pose Tracker with Anchor-Based Keypoints Change of 6D Pose between frames We present 6-PACK, a deep learning approach to category-level 6D object pose tracking on RGB-D data. Our method tracks in real time novel object instances of known object categories such as bowls, laptops, and mugs. 6-PACK learns to compactly represent an object by a handful of 3D keypoints, based on which the interframe motion of an object instance can be estimated through keypoint matching. These keypoints are learned end-to-end without manual supervision in order to be most effective for tracking. Our experiments show that our method substantially outperforms existing methods on the NOCS category-level 6D pose estimation benchmark and supports a physical robot to perform simple vision-based closed-loop manipulation tasks. Our code and video are available at https://sites.google.com/view/6packtracking.
False	1910.10750v1.pdf	Scene Text Detection; Total-Text; Precision	6-PACK: Category-level 6D Pose Tracker with Anchor-Based Keypoints Change of 6D Pose between frames We present 6-PACK, a deep learning approach to category-level 6D object pose tracking on RGB-D data. Our method tracks in real time novel object instances of known object categories such as bowls, laptops, and mugs. 6-PACK learns to compactly represent an object by a handful of 3D keypoints, based on which the interframe motion of an object instance can be estimated through keypoint matching. These keypoints are learned end-to-end without manual supervision in order to be most effective for tracking. Our experiments show that our method substantially outperforms existing methods on the NOCS category-level 6D pose estimation benchmark and supports a physical robot to perform simple vision-based closed-loop manipulation tasks. Our code and video are available at https://sites.google.com/view/6packtracking.
False	1910.10750v1.pdf	Link Prediction; YAGO3-10; Hits@1	6-PACK: Category-level 6D Pose Tracker with Anchor-Based Keypoints Change of 6D Pose between frames We present 6-PACK, a deep learning approach to category-level 6D object pose tracking on RGB-D data. Our method tracks in real time novel object instances of known object categories such as bowls, laptops, and mugs. 6-PACK learns to compactly represent an object by a handful of 3D keypoints, based on which the interframe motion of an object instance can be estimated through keypoint matching. These keypoints are learned end-to-end without manual supervision in order to be most effective for tracking. Our experiments show that our method substantially outperforms existing methods on the NOCS category-level 6D pose estimation benchmark and supports a physical robot to perform simple vision-based closed-loop manipulation tasks. Our code and video are available at https://sites.google.com/view/6packtracking.
False	1910.10750v1.pdf	Heterogeneous Node Classification; DBLP (PACT) 14k; Macro-F1 (60% training data)	6-PACK: Category-level 6D Pose Tracker with Anchor-Based Keypoints Change of 6D Pose between frames We present 6-PACK, a deep learning approach to category-level 6D object pose tracking on RGB-D data. Our method tracks in real time novel object instances of known object categories such as bowls, laptops, and mugs. 6-PACK learns to compactly represent an object by a handful of 3D keypoints, based on which the interframe motion of an object instance can be estimated through keypoint matching. These keypoints are learned end-to-end without manual supervision in order to be most effective for tracking. Our experiments show that our method substantially outperforms existing methods on the NOCS category-level 6D pose estimation benchmark and supports a physical robot to perform simple vision-based closed-loop manipulation tasks. Our code and video are available at https://sites.google.com/view/6packtracking.
False	1910.10750v1.pdf	Word Sense Disambiguation; SemEval 2007 Task 17; F1	6-PACK: Category-level 6D Pose Tracker with Anchor-Based Keypoints Change of 6D Pose between frames We present 6-PACK, a deep learning approach to category-level 6D object pose tracking on RGB-D data. Our method tracks in real time novel object instances of known object categories such as bowls, laptops, and mugs. 6-PACK learns to compactly represent an object by a handful of 3D keypoints, based on which the interframe motion of an object instance can be estimated through keypoint matching. These keypoints are learned end-to-end without manual supervision in order to be most effective for tracking. Our experiments show that our method substantially outperforms existing methods on the NOCS category-level 6D pose estimation benchmark and supports a physical robot to perform simple vision-based closed-loop manipulation tasks. Our code and video are available at https://sites.google.com/view/6packtracking.
False	1910.10750v1.pdf	Neural Architecture Search; CIFAR-10; Search Time (GPU days)	6-PACK: Category-level 6D Pose Tracker with Anchor-Based Keypoints Change of 6D Pose between frames We present 6-PACK, a deep learning approach to category-level 6D object pose tracking on RGB-D data. Our method tracks in real time novel object instances of known object categories such as bowls, laptops, and mugs. 6-PACK learns to compactly represent an object by a handful of 3D keypoints, based on which the interframe motion of an object instance can be estimated through keypoint matching. These keypoints are learned end-to-end without manual supervision in order to be most effective for tracking. Our experiments show that our method substantially outperforms existing methods on the NOCS category-level 6D pose estimation benchmark and supports a physical robot to perform simple vision-based closed-loop manipulation tasks. Our code and video are available at https://sites.google.com/view/6packtracking.
False	1910.10750v1.pdf	3D Object Detection; KITTI Pedestrians Hard; AP	6-PACK: Category-level 6D Pose Tracker with Anchor-Based Keypoints Change of 6D Pose between frames We present 6-PACK, a deep learning approach to category-level 6D object pose tracking on RGB-D data. Our method tracks in real time novel object instances of known object categories such as bowls, laptops, and mugs. 6-PACK learns to compactly represent an object by a handful of 3D keypoints, based on which the interframe motion of an object instance can be estimated through keypoint matching. These keypoints are learned end-to-end without manual supervision in order to be most effective for tracking. Our experiments show that our method substantially outperforms existing methods on the NOCS category-level 6D pose estimation benchmark and supports a physical robot to perform simple vision-based closed-loop manipulation tasks. Our code and video are available at https://sites.google.com/view/6packtracking.
False	1910.10750v1.pdf	Few-Shot Image Classification; CUB-200-2011 - 0-Shot; Top-1 Accuracy	6-PACK: Category-level 6D Pose Tracker with Anchor-Based Keypoints Change of 6D Pose between frames We present 6-PACK, a deep learning approach to category-level 6D object pose tracking on RGB-D data. Our method tracks in real time novel object instances of known object categories such as bowls, laptops, and mugs. 6-PACK learns to compactly represent an object by a handful of 3D keypoints, based on which the interframe motion of an object instance can be estimated through keypoint matching. These keypoints are learned end-to-end without manual supervision in order to be most effective for tracking. Our experiments show that our method substantially outperforms existing methods on the NOCS category-level 6D pose estimation benchmark and supports a physical robot to perform simple vision-based closed-loop manipulation tasks. Our code and video are available at https://sites.google.com/view/6packtracking.
